{
  "projection_version": "0.1",
  "projection_status": "DEVELOPMENT_ONLY",
  "technique_key": "LC-001",
  "canonical_identifier": null,
  "identifier_status": "NOT_ASSIGNED",
  "name": "Separation by Distant Placement",
  "strauss_status": "EXPLICITLY NAMED AND ENUMERATED",
  "source": {
    "authoritative_object_path": "engine_training/Hermeneutic_Object_Strauss_Taxonomy_of_Literary_Concealment_v1.0.txt",
    "authoritative_object_version": "v1.0",
    "authoritative_object_sha256": "0a155194f72a4517d267256b37fe4b68fe1144e0ef8ec3a1a26c3b3ad5b9f0e5",
    "repository_commit": "7100700ef10d68621f4859b5fe94fac6e5e0fcea",
    "primary_work": "Persecution and the Art of Writing",
    "primary_essay": "The Literary Character of the Guide for the Perplexed",
    "source_page": 70,
    "source_formulation": "to speak of the same subject in a contradictory manner on pages far apart from each other",
    "source_symbol": "a = b (page 15) — a ≠ b (page 379)"
  },
  "mechanism": "Two incompatible statements concerning the same subject are separated within a work so that ordinary reading may fail to hold them together.",
  "investigative_requirement": "Compare statements concerning the same subject across the whole work rather than treating local context as the complete evidentiary field.",
  "distinctions": [
    "LC-001 concerns positional separation; it does not by itself concern unequal prominence, which belongs to LC-002.",
    "LC-001 requires a contradiction between propositions, not merely a thematic tension or difference of emphasis.",
    "Distance is an attention-obscuring condition, not proof of concealment or proof of authorial intention.",
    "No fixed numerical page threshold is constitutive; Strauss states that careless reading permits any positive separation to function this way."
  ],
  "operational": {
    "trigger_conditions": [
      "Two distinct statement records occur in the same work.",
      "Both statements concern the same reconstructed subject.",
      "The propositions are mutually incompatible after explicit reconstruction.",
      "The statements occupy positively separated positions in the work."
    ],
    "minimum_evidence": [
      "Exact recoverable text of both statements.",
      "Stable witness and location for both statements.",
      "Documented reason for treating both statements as concerning the same subject.",
      "Explicit proposition-level account of the contradiction.",
      "Complete local context for both statements.",
      "Resolved speaker, quotation, dramatic voice, or reported-opinion attribution.",
      "Evidence path preserving every transformation from passage to proposition."
    ],
    "corroboration_indicators": [
      "Additional statements on the same subject reproduce or sharpen the incompatibility.",
      "Exact or controlled lexical recurrence links the separated passages.",
      "The author explicitly claims exceptional care in composition or awareness of contradictions.",
      "Placement, sequence, omission, repetition, or another independently reconstructed device connects the passages.",
      "A source explicitly identified by the author clarifies that the contradiction is deliberate or pedagogically governed."
    ],
    "ordinary_alternatives": [
      "The statements concern different senses of the same term.",
      "One statement is conditional, qualified, hypothetical, dialectical, ironic, or reported rather than asserted.",
      "The work records development or a genuine change of position over time.",
      "The statements address different audiences, circumstances, cases, or levels of generality.",
      "One statement belongs to a different speaker or cited authority.",
      "A textual variant, translation problem, transcription error, or corrupt witness creates the appearance of contradiction.",
      "The contradiction is an ordinary mistake rather than a literary operation."
    ],
    "disqualifying_conditions": [
      "The statements do not concern the same subject.",
      "The propositions are compatible once terms, scope, time, condition, or attribution are reconstructed.",
      "The two records are duplicate witnesses of one statement rather than distinct statements.",
      "Source integrity or speaker identity cannot be established.",
      "The alleged contradiction is inferred solely from topic similarity or embedding distance.",
      "Only one statement is recoverable."
    ],
    "authorized_response": [
      "Register the pair as a noncanonical development candidate.",
      "Recover both passages and their full local contexts.",
      "Reconstruct each statement independently before comparison.",
      "Test all ordinary alternatives and preserve unresolved ones.",
      "Search the whole work for additional statements on the same subject.",
      "Seek independent corroborating indicators.",
      "Open a bounded interpretive inquiry only after the documentary trigger survives adversarial testing.",
      "Terminate with underdetermination when the evidence cannot distinguish competing explanations."
    ],
    "prohibited_inferences": [
      "Do not infer that the author intentionally concealed a teaching from contradiction and distance alone.",
      "Do not infer that a hidden teaching exists merely because two statements conflict.",
      "Do not select the rarer, later, less prominent, or more radical statement as true under LC-001 alone.",
      "Do not attribute private intention, fear of persecution, audience manipulation, or esotericism without separate evidence.",
      "Do not merge LC-001 with LC-002 or any other technique.",
      "Do not present a semantic-search match or graph proximity as documentary evidence."
    ],
    "uncertainty_rule": "Until source integrity, subject identity, contradiction, context, attribution, ordinary alternatives, and corroboration are recorded, the engine must preserve the pair only as a candidate and may not characterize it as concealed teaching.",
    "termination_rule": "Terminate LC-001 evaluation when the pair is disqualified, when a missing source blocks reconstruction, when an ordinary explanation resolves the contradiction, or when the evidence remains underdetermined after bounded testing."
  },
  "local_evaluation_outcomes": [
    "NOT_TRIGGERED",
    "BLOCKED_MISSING_EVIDENCE",
    "CANDIDATE_PAIR",
    "CORROBORATED_CONTRADICTION"
  ],
  "version_history": [
    {
      "version": "0.1",
      "status": "DEVELOPMENT_ONLY",
      "change_note": "First executable projection of LC-001. Preserves the human-readable Hermeneutic Object as authoritative and grants no canonical, certification, integration, or production authority."
    }
  ]
}
